movie_title,reviewer,review,rating_given
Memory,Brent Marchant,"How we remember our past is something we can all bank on, right? Or is it? For instance, what happens when mitigating influences impact our memory, potentially causing it to become fallible and untrustworthy? Can we truly rely on our recall then? Those are among the questions raised in the unconventional new romantic thriller from writer-director Michel Franco. The film follows the life of Sylvia, a recovering alcoholic with a troubled past (Jessica Chastain), who’s unexpectedly (and alarmingly) followed home from her high school reunion by an alleged former classmate, Saul (Peter Sarsgaard), whom she believes sexually molested her at that time. She’s troubled by this latest development and questions his motives about it, which even he doesn’t understand, especially when it’s revealed that he suffers from dementia. And, in an added twist, it turns out that Sylvia’s recall about her supposed past interaction with him is foggy, something that’s not entirely surprising in light of her history. This revelation changes everything, and an entirely new relationship between them emerges, particularly when it comes to each of them helping one another sort of their respective pasts and begin the healing process. This includes the exposure of an array of additional developments and the persistence of some still-unresolved ambiguities, all of which emerge through a skillfully crafted narrative, effectively brought to life with the superb performances of Sarsgaard and Independent Spirit Award nominee Chastain. Admittedly, the picture’s first half could benefit from some stepped-up pacing, most notably the elimination of some sequences that are occasionally redundant and innately tiresome. However, the intrigue and engagement ramp up significantly in the picture’s back end, making up for much of the tedium in the opening act. Some of this is ironically accomplished through deftly handled nuance and subtlety, qualities that the filmmaker employs far more skillfully in the second half than in the first, where these traits are virtually obscured by prevailing understatement. Clearly, this is one of those releases that requires the viewer to give it some time to develop, but the payoff for doing so is worth it in the end. If nothing else, “Memory” provides us with a fresh perspective on its central theme while showing us how “like can cure like” in a psychological therapeutic process, an approach that can yield rewards beyond measure.",7.0
Memory,CinemaSerf,"Whilst the subject matter here is quite interesting, the execution isn't especially. ""Sylvia"" (Jessica Chastain) is working in the social care system whilst bringing up her daughter ""Anna"" (Brooke Taylor). Her life, as effectively illustrated by her door locking and burglar alarm routine each day, is a structured affair with little variation. She has a strong relationship with her sister but is completely estranged from her mother. The two women attend a school reunion one night and, leaving early, she is followed home. It's a miserable night and next morning she discovers him asleep outside her door. Inspecting his wallet, she discovers his identity and calls his brother ""Isaac"" (Josh Charles) who explains that ""Saul"" (Peter Sarsgaard) has memory issues. Was he stalking her or is there more to this rather meandering scenario? Chastain does work quite well, but I found the story seemed to randomly inject way too many ""incidents"" along the way that seemed designed to enliven or empower the plot. Many seemed a little too disaster-scenario prone and are used to enhance purely for dramatic purposes. The culminating scenes lacked plausibility and at times the whole thing came across as little better than an A-list soap opera. Coincidence underpins just a bit too much of the film and the delivery of information about the characters to the audience is all delivered in just too sporadically a fashion. I felt sorry for just about everyone involved, but I didn't feel particularly engaged.",6.0
May December,Lachlan Thiele,"<b>INT. MOCKING-MOORE - DAY </b>

May December is an excellent satire with incredibly dark themes at times. Portman's Elizabeth is an actress tasked with researching her next role, a movie based on the massively dramatised life of <i>Julianne Moore's</i> character. Moore and Portman shine in their roles, and both can create believable characters whilst still pushing the unbelievable humour and situations they are put in. Portman, mainly with her fascination with making an actual 'true-to-life' performance as <i>Gracie</i>, copies her quirks and tendencies, providing the audience with laughs. 
Primarily the humour lies in the dark aspects of the film. The funniest, without spoiling, Gracie's relationship with her husband. It continuously evolves over the film, and we finally reach a satisfying conclusion. It's interesting how the comedy-drama has the best character arcs out of all of the dramas that premiered at Cannes. 
Overall, <i>May December</i> lands on both feet, standing tall against the competition. Satirical, well-acted and entertaining. 

<b>FADE OUT</b>",8.0
May December,CinemaSerf,"This actually reminded me a little of ""All About Eve"" (1950) as television actress ""Elizabeth"" (Natalie Portman) arrives at the home of ""Gracie"" (Julianne Moore) about whom she is to star in a biopic. Initially welcoming of her and keen to help, we follow the changing dynamic as we learn that ""Gracie"" has quite a past, and that her husband of 20-odd years, ""Joe"" (Charles Melton) is considerably younger than her and there was quite a furore when they first hooked up that saw the older woman incarcerated. The more she finds out, the more involved ""Elizabeth"" becomes and the more immersed we all become in this quite compelling story of a taboo that rather broke a mould or two and is now surrounded by an atmosphere of hypocrisy, faux-friendships, and lemon drizzle cake. There is a strong, increasingly well delivered, competitiveness between these two women and Melton delivers quite strongly too as the young man who seems devoid of much purpose as he heads towards his forties. The script is quite tight, frequently potent and Todd Haynes's overall style of intimate direction genuinely encourages us to invest a little in one of the women - I didn't manage to invest in both, especially as the denouement loomed (perhaps just a little predictably). This film quite successfully presents us with quite an interesting character study that works both ways in their relationship - and is well worth a watch.",7.0
May December,Brent Marchant,"In moviemaking, there’s subtlety, and then there’s subtlety carried too far. In the case of director Todd Haynes’s latest, the filmmaker unfortunately indulges himself far too much in the latter. This story of an actress (Natalie Portman) who visits a middle-aged sex offender (Julianne Moore) to prepare for a role she’s about to play in a movie about her subject’s life never seems to find a footing to stick with and explore. The narrative examines many different aspects of the back story behind the lives of the characters to be portrayed in this pending production without ever really resolving any of them by the time the credits roll. This includes not only the protagonist’s reasons for pursuing her once-underage husband (Charles Melton) – actions that got her jailed and made her fodder for countless tawdry tabloid cover stories – but also the nature of the actress’s real motivations in conducting such an excessively intense in-depth study of her character. In the process, virtually everyone comes across as somewhat unsavory, and, considering that the truth is never clearly revealed about any of them, it begs the question, why should we care about any of this? The film depicts all of this so subtly that it goes beyond nuance, veering into the realm of enigmatic, thereby further reinforcing the notion of why any of us should care. Ironically, these underplayed elements are in stark contrast to some rather obvious (and terribly trite) symbolism, particularly in images related to themes of transition and transformation. The picture’s inconsistent changes in tone don’t help, either, vacillating between allegedly serious drama and a seemingly underdeveloped desire to break out as an exercise in full-fledged camp (which, by the way, probably would have made this a much better offering). The script’s meandering flow and glacial pacing also don’t help, leaving viewers scratching their heads more often than not as to where this story is headed. In the end, all of the foregoing is ultimately quite unfortunate, because there’s definite potential in this project, but it’s never adequately defined and fleshed out. Leads Moore and (especially) Portman turn in admirable efforts to make this material fly, but they simply don’t have enough to work with to make that happen. While there appear to be allusions to themes like the difficulty involved in dealing with long-buried feelings and the fact that we may never be able to adequately grasp the truth behind them (either as outsiders looking in or as active participants in the midst of such dealings), the cryptic handling of those ideas undermines whatever meaningful messages or cinematic value they might have, making all of this seem like just such a big waste of time. Director Haynes has an impressive filmography behind him with such releases as “Poison” (1991), “Far From Heaven” (2002) and “Dark Waters” (2019), but, regrettably, “May December” certainly can’t be counted as part of that list.",5.0
May December,r96sk,"Bit of a odd one. It gradually lost my attention a little the longer it went on, though overall it's a film I'd consider as interesting.

I know of the real life story that <em>'May December'</em> is ""loosely"" based upon, so it was intriguing early on to see how the film was going to tackle it. I think they did a good enough job with it all, the actress meeting the subject element makes the film more watchable than it otherwise would have been.

Natalie Portman, Julianne Moore and Charles Melton are a great trio onscreen, each giving a noteworthy performance. Portman impressed me most, though Melton really does come strong across the second part of the movie. The rest of the cast do well, particularly solid casting of the main two characters' children.

A very well made production, just one that did lose me slightly as it headed through its near 2hr run time - could've been shorter, imo. The main piano score, although excellent in itself, gets minorly annoyingly overused too. No hate though, I still enjoyed it and would recommend it.",7.0
May December,justhappytobehere,"Mostly a boring affair, with a few nice pieces of performance from time to time. Portman was never a good actor and she delivers another dead eyed performance. Moore was quite good and so was the man child. I guess check it out or not, it really doesn't matter.",6.0
The Book of Clarence,Manuel São Bento,"FULL SPOILER-FREE REVIEW @ https://fandomwire.com/the-book-of-clarence-bfi-london-film-festival-review-hilarious-thought-provoking-biblical-satire/

""The Book of Clarence certifies Jeymes Samuel as a do-it-all in filmmaking. Whether through his stylized direction, thought-provoking satirical screenplay, or bold soundtrack, the filmmaker once again delivers a highly original, genuinely hilarious blend of genres and tones, and a captivating spiritual exploration of the protagonist.

Fortunate as well to have an absolutely superb cast with LaKeith Stanfield commanding the troops, delivering an impressively all-round performance. It lacks better tonal balance and more unpredictability, the latter being destroyed by an unnecessary opening sequence.

Glad to know it will be released on the big screen, which is where I definitely recommend everyone to go and experience this piece of guaranteed entertainment.""

Rating: B+",7.0
The Book of Clarence,BornKnight,"If you watched and know the style of Jeymes Samuel as writer and director you know what to expect (The Harder they Fall, They Die by Down). 

It tells the story of a man that is a con artist that aims to be a new Messiah, in the age of Jesus (and alongside him - 3 days behind), but not a classical Jesus or a new correct etiology one, but one in a black Jerusalem.

It have some interesting messages more to end, shows Romans as the whites, and do not mention proper Jews - it also doesn't choose to what it aims as a movie, comedy or drama putting some comic sequences and references of Marijuana (that was used already in that time, a certain thing, accidental or not). 

LaKeith Stanfield is the star of the movie and does well his role and multiplicity of his character. But this isn't enough to make this a good movie.  

To me a score of 6.0 out of 10.0 / B-, almost C+.",6.0
Baghead,CinemaSerf,"""Iris"" (Freya Allan) unexpectedly inherits a dilapidated pub from her estranged father (Peter Mullen) and is actively encouraged to just sell it by the solicitor (the always good at the creepy characters Ned Dennehy). She decides to spend a night - along with some VHS instructions - in the place to think on things and encounters the enigmatic young ""Neil"" (Jeremy Irvine) who offers her £4,000 so he can talk to his wife in the cellar! She tells him to come back next day, asks her lawyer pal ""Katie"" (Ruby Barker) to come and stay and before too long reckons she could be on to a cunning money-making wheeze. He comes back and to the cellar the three head. Two chairs and a great big hole in the wall greet them, followed by some filthy and scrawny fingers as the eponymous woman emerges from the darkness and... Yikes! Rather than being scared witless, ""Iris"" does a wee bit of research and concludes that she can control this scenario and make loads of cash too. ""Katie"" isn't so easily convinced and the lovelorn ""Neil"" is clearly working on a solution that will work more permanently for him! There are some startlingly stupid decisions made by the characters in this film, and some of the (sparing) visual effects are the stuff of the ""Exorcist"" from fifty years ago, but as a low-budget enterprise it is no worse than your standard Blumhouse fayre that trot in and out of our cinemas every few weeks. The acting is all adequate, as is the writing and the story has it's moment of intrigue as it develops. Though I'll never remember watching it in a fortnight, I quite enjoyed it for the ninety minutes leading to a denouement that I did rather like.",6.0
Monster,Lachlan Thiele,"INT. COOKIE MONSTER – NIGHT

Monster is the latest entry in the Kore-eda filmography (a filmography I still need to dive deeper into). Still, just like his previous films, It's a deeply personal look into a character, their motives but most importantly, how that motive affects those around them.

Monster is a multi-layered beast; it retells one story from multiple perspectives giving us the whole cookie instead of just the crumbs. Usually, I'm a crumb kinda guy; I like to figure things out myself, putting them all together to get my cookie. Still, Kore-eda gives me the cookie; at points, he just hands the cookie over when instead I would have preferred the traditional 'show, don't tell' filmmaker mentality. Yet, without that one little critique Monster would have shot right up to a 4-star thanks to its standout performances from Sakura Ando as the mother and excellent direction (especially when it comes to blocking actors within a scene, yeah, I know a weird thing to point out but something I wrote down while watching) 

Anyway, please head out and see this one. It's worth the spoon-feeding.

FADE OUT.",7.0
Monster,Lachlan Thiele,"INT. COOKIE MONSTER – NIGHT

Monster is the latest entry in the Kore-eda filmography (a filmography I still need to dive deeper into). Still, just like his previous films, It's a deeply personal look into a character, their motives but most importantly, how that motive affects those around them.

Monster is a multi-layered beast; it retells one story from multiple perspectives giving us the whole cookie instead of just the crumbs. Usually, I'm a crumb kinda guy; I like to figure things out myself, putting them all together to get my cookie. Still, Kore-eda gives me the cookie; at points, he just hands the cookie over when instead I would have preferred the traditional 'show, don't tell' filmmaker mentality. Yet, without that one little critique Monster would have shot right up to a 4-star thanks to its standout performances from Sakura Ando as the mother and excellent direction (especially when it comes to blocking actors within a scene, yeah, I know a weird thing to point out but something I wrote down while watching) 

Anyway, please head out and see this one. It's worth the spoon-feeding.

FADE OUT.",7.0
Monster,Brent Marchant,"The perspective from which we view a situation infallibly provides us with a clear, irrefutable picture of its truthfulness, right? But what happens if we encounter someone who witnesses the same incident and comes away from it with a totally different interpretation? Both views can’t be “right,” can they? Or is it possible that none of us can see the totality of a scenario and claim to know everything about it? That’s the core takeaway from director Kore-eda Hirokazu’s latest feature, an ambitious, skillfully crafted tale told from multiple vantage points, all of them “correct” in their own right, despite the myriad differences that distinguish them from one another, a storytelling technique first developed by Japanese master filmmaker Akira Kurosawa in the screen classic “Rashomon” (1950). Kore-eda’s cinematic homage to the famed auteur, told in three separate but interconnected segments, focuses on the exploits of a rebellious pre-teen (Soya Kurokawa) seemingly prone to acting out as a bully. The youth’s unpredictable behavior, however, doesn’t tell the whole story. His actions appear to be cryptically interwoven with those of his overly protective widowed mother (Sakura Ando), his young middle school teacher (Eita Nagayama), his aging, softspoken principal (Yuko Tanaka), and his effervescent best friend (Hinata Hiiragi), many of whom aren’t always what they seem to be. There are forces at work here that are a cause for concern, prompting the often-asked question, “Who is the monster?”, a query that provides the inspiration for this film’s title. It’s intriguing to watch how the picture’s various story threads come together, reminding us of the old adage of not judging a book by its cover, poignantly illustrating that, no matter how much we may think we know about a particular situation, there’s a good chance we’ll never get a complete picture of it. Kore-eda serves up an eye-opening tale, one that gives us pause to think about our impressions and preconceptions in an age when many of us are all too quick to superficially judge what we see – and in a frequently flawed framework at that. The picture could stand to be a little more swiftly paced at times (especially in the final act), but this is arguably the director’s best and most sensitive work to date, one that, we can only hope, will have the kind of profound impact we need in an age where open-mindedness and tolerance are traits we could all stand to develop to a much greater degree – particularly when pieces of the puzzle are missing.",8.0
Monster,CinemaSerf,"I'm not usually a fan of children leading films, but hats have to come off here for a really delightful performance from the young Hinata Hiiragi as the shy and shunned ""Hoshikawa"". We will get to him in a minute, but first the film is delivered in three parts as a fire slowly devours a city centre tower block. The first episode introduces us to ""Minato"" (Soya Kurukawa). He's a bright and friendly boy who lives with his widowed mother (Sakura Ando). She starts to notice that his behaviour is a becoming a bit erratic and after some investigation begins to suspect that he is being bullied at school. A visit to the recently bereaved Principal (Yûko Tanaka) reveals that his teacher ""Hori"" (Eita Nagayama) might be the culprit and apologies are made. The next segment takes up the same story, only this time we look from the perspective of the teacher, a caring and enthusiastic professional. Though there are similarities between the two scenarios, the conclusion from the first doesn't quite tie up with the information from the second. Then to the final instalment where the two boys take and hold really well the centre stage of this drama and we get to grips with the puzzles set already and discover more about their complex characters. It's this third phase that is quite captivating to watch. The older boy must tread a thin line between a peer pressure that thinks his friend is odd, even that he has ""a pig's brain"" whilst he, himself, realises that ""Hoshikawa"" is a friendly, curious and loyal lad who has quite a few domestic demons of his own to face, on pretty much a daily basis. Amongst the adults, there's plenty going on too. The head teacher is clearly sitting on a fairly hefty secret of her own and ""Mr. Hori"" faces a series of predicaments that reminded me a little of the recent ""Teacher's Lounge"". A typhoon, some tunnels and an old railway carriage provide a perfect focus for the concussion that isn't so much that, it's an invitation to see what might happen next. The director excels here at putting us into the minds of the children and of the adults whilst also allowing our own observations to watch a story of two young children at a sensitive stage of their lives - and it really does make you think and reminisce about your own childhood in equal measure. ",7.0
It Lives Inside,CinemaSerf,"Well we've had Mandarin and Spanish integrated into dual-dialogue Hollywood films recently, so I suppose it was only a matter of time before another language featured - and we have it here in the partial use of Hindi. Thereafter, though, this is an entirely unremarkable drama centring around the young ""Sam"" (Megan Suri) who is trying to balance her life of traditional roots and modern American attitudes. This confusion and uncertainty, coupled with a recently smashed jam jar is allowing a strange and powerfully malevolent critter to come out and thrive on all of this discord - and to kidnap her best mate ""Tam"" (Mohana Krishnan) - the original owner of the jar! Can ""Sam"" and her all-American beau ""Russ"" (Gage Marsh) possibly get to the bottom of it all? As surely as we will all soon be leaving the cinema - and that's really the problem here. There is nothing at all new, nothing scary - the visual effects; darkened streets, flickering lightbulbs - we've all seen it so often before and though the Indian cultural aspect is welcome, it doesn't really add anywhere near enough to this teenage adequately performed finding-herself story that rather bored me. Halloween telly if ever I saw it, I wouldn't bother paying to see it at a cinema, sorry.",5.0
Tenet,SWITCH.,"I fully understand that Christopher Nolan is trying to play with time, as that what's the movie's about - and yes, he is known for confusing movies - but here, Nolan has made something uninteresting. The idea of things going backwards is cool, but the rules are unclear. We never know what the basic goal is - I could understand secrets, but the film has to be interesting and 'Tenet' simply isn't. Nothing here makes me want to work things out; it's forgettable. Sure, you can say this has to be seen on the big screen, but the long runtime makes it unappealing to most mainstream audiences. Unfortunately, 'Tenet' is not here to save the 2020 box office. I work at a cinema, and to say it underperformed well would be correct. We are going to see more 'Tenet' hot-take YouTube videos than thinkpiece/what you missed ones. Christopher Nolan has made his most forgettable film to date - it's not a bad movie and I'm sure his diehard fans will adore this one, but for everyone else, there isn't much here. 'Tenet' won't be remembered as another “groundbreaking visual spectacle“ from Nolan or for “saving cinema“. It will be remembered for its weird release schedule and having been shown during a global pandemic, and that's unfortunate. Like the rest of the year, 'Tenet' is a write-off.

Read Chris' full article...
https://www.maketheswitch.com.au/article/review-tenet-time-runs-up-like-my-enjoyment-of-nolans-latest-film",6.0
