movie_title,reviewer,review,rating_given
Kung Fu Panda 4,Chris Sawin,"_Kung Fu Panda 4_ isn’t the best _Kung Fu Panda_ film, or even the best of the series’ three sequels. However, as a fourth film in a franchise, it’s a ton of fun.

And though it’s action isn’t quite as entertaining as its predecessors and it’s unfortunate to see Awkwafina playing yet another thief (_Jumanji: The Next Level_ says hello), for the most part, _Kung Fu Panda 4_ happily skadooshes its way to animated greatness.

**Full review:** https://bit.ly/KuFuPa4",6.0
Damsel,thorian93,"Today I enjoyed: Damsel.

Damsel is a Netflix Original, that was released just a few days ago. Starring a strong cast with Millie Bobby Brown, Robin Wright, Angela Bassett and the voice of Shohreh Aghdashloo it follows the odyssey of Elodie. I am not going to spoil the plot for you, but I bet you can foresee most developments, dear reader.

Overall I have mixed feelings. The story is nothing new, most elements are well known for this kind of movie. Some decisions of characters (including the dragon) feel dumb, and sometimes our main character gets very lucky, so the rest of the plot can happen. The CGI ranges from poor to pretty good, poor more in the begging, with huge landscapes and castles, but later, when the dragon makes an appearance, it looks pretty decent. But I was watching on a rather small screen and Netflix is punishing me with mediocre quality for some time now. So take my visual rating with a grain of salt. Now one thing I will say about the dragon: It has an interesting spin to it. For one thing, half of the time, we do not really see it and only hear Shohreh Aghdashloo's deep, rasping voice, bringing it to life. And when we actually see the dragon, it has a slight horror touch if you will. It looks like a hybrid between your average majestic and broadly loved dragon and something more dark and slimy. A muskrat comes to mind. I liked that (sort of).

One remark towards the title: While it is obviously a play the well known 'Damsel in distress' and obviously Elodie fights instead of needing to be rescued, she screams a lot and actually seems in distress half of the film. Until she suddenly becomes the hero and single-handedly fights the dragon. It is a bit much and hard to believe.

This is in all honesty an average movie. It is neither terrible nor great. If you are in the mood for some imagery, gold and jewels, dragons, princesses, and a few swords, then go for it. There are worse ways to spend roughly 109 minutes. But there are also better ways.

_Originally posted on my blog: https://robingierse.de/blog/tie-damsel._",6.5
Damsel,Manuel São Bento,"FULL SPOILER-FREE REVIEW @ https://talkingfilms.net/damsel-review-a-generic-yet-immersive-fantasy-flick/

""Damsel attempts to deliver a tale of empowerment and adventure within the rich fantasy genre but finds itself entangled in the ropes of predictability and missed opportunities for deeper narrative innovation.

Despite its shortcomings, the film shines through its technical prowess, from visually stunning effects to immersive world-building, and is anchored by Millie Bobby Brown’s compelling lead performance.

While it may not redefine its genre or leave an indelible mark on the history of cinema, it’s a pleasant home viewing with moments of genuine charm and resilience.""

Rating: B-",6.0
No Way Up,OrlyForly,"Terrible Script, dialogue, directing, hammy editing. Music is meh. Poor acting (but they clearly got no support). This crap show's the contempt producers like this have for the audience that gives them money. The writer, director, producers and editor must have been so full of ego that I bet continues today, despite the poor reviews. During the boring minutes (90) I drifted off imagining them all working on these scenes thinking they were amazing, and trying to understand the level of narcissism required. Just delusional film makers that like the smell of each others farts. During the credits I imagined the director is still down there and that's what got it 0.5 rather than 0.",1.0
No Way Up,Chandler Danier,This movie is less realistic than Slotherhouse. No one on the crew had their Open Water certification. Absolute crap. 3 because they killed that one really annoying guy who sucked and I imagine he's the wretched people who wrote/directed this crap. But it's only 1.5 hours so...I kinda like it. Would have been 20 minutes had they just opened the door so...I really hate it.,3.0
Argylle,Manuel São Bento,"FULL SPOILER-FREE REVIEW @ https://talkingfilms.net/argylle-review-a-delightful-surprise-of-campy-entertainment/

""Argylle emerges as a (very) pleasant surprise this new year, blending absurdity with sophistication to create a truly memorable cinematic experience.

Matthew Vaughn's vision, combined with Jason Fuchs' sharp, clever screenplay, provides an entertainment rollercoaster ride that obliterates initial expectations. From unexpected twists and turns to the incredibly charismatic cast, not to mention a third act filled with hilariously unforgettable action set pieces, the complex-made-simple spy story captivates the audience with its campy charm and relentless energy.

It's my first big recommendation of 2024, one you can't afford to miss in theaters!""

Rating: A-",8.0
Argylle,CinemaSerf,"""Elly Conway"" (Bryce Dallas Howard) lives in her remote lakeside home writing spy novels that are going down a storm. Her conclusion to the fifth in the series about the eponymous, ""007""-style agent perplexes her mother, though. What happens next? Well wait til book six would seem to be the obvious answer, but mom (Catherine O'Hara) insists so ""Elly"" decides to take train to visit her parents - and that's mistake number one. Onboard she encounters a rather scruffy looking chap ""Wilde"" (Sam Rockwell) who is reading one of her books. She tries to hide her identity, but when he gets to the fly-leaf then her secret is out. That's soon the least of her worries as she and travelling cat ""Alfie"" are soon caught up in something straight out of one of her books! She can't fathom why she'd conceivably be the target for any nasty people, but her new found friend soon convinces her that there is someone she has to meet - and pretty quickly she's embroiled in an whole new world of mystery, intrigue and danger! It's a bit of a slow start this film, with a slightly annoying flicking between her real life and those of her characterisations (that's where the ""Action Man"" style of the sparingly used Henry Cavill appears) but once we establish who is who and what's going on, we are straight into ""Man from U.N.C.L.E."" territory with loads of rapid-fire escapades that though hardly original, do have some fun twists and turns as we progress to a denouement that is derivative, but still quite enjoyable to watch. The initial concept is quite original and though the execution largely an amalgam of other Matthew Vaughn features, it still works quite well even if it is far too long, with Rockwell clearly having some fun here and the cat remaining largely contained in it's capsule throughout!",7.0
Argylle,Brent Marchant,"It’s disappointing when a film has an intriguing premise but fails to deliver the goods in the end. Such is the case with director Matthew Vaughn’s latest, an action-adventure/comedy about an author of spy novels (Bryce Dallas Howard) who stumbles into a real-life espionage scenario that matches the plot of her latest novel, embroiling her in a web of ever-shifting intrigue with various nefarious parties. The problem here is that the film never quite latches onto a dedicated focus to make the picture work. Some of the comic bits are indeed quite funny, but they frequently get bogged down by a meandering story line that’s trying to follow a more conventional, twist-laden thriller format. It leaves viewers asking, “So what’s it going to be?” There’s also more than a little derivative material thrown in, such as story threads we’ve already seen before in movies like “Romancing the Stone” (1984), “The Long Kiss Goodnight” (1996) and any number of James Bond flicks. While it’s true that this release is intended to be a spoof of these titles (especially in scenes featuring Henry Cavill as a hilariously hammy 007 knock-off), there’s a big difference between paying tribute and playing unrepentant copycat. Then there’s the picture’s excessive length, coming in at a bloated 2:19:00 runtime, far longer than it needs to be, a failing attributable to an often-needlessly complicated plot, one that begins to try audience patience at times, especially in the back half. “Argylle” also features a cute, cuddly cat, Alfie, as a central character (at least in its trailer), but, like the narrative overall, the film doesn’t quite seem to know what to do with the supposedly frisky, fickle feline, an impression far different from what’s conveyed in the picture’s video marketing. All of this is a shame, because this title has both potential and some apparent strengths going for it, such as a fine soundtrack, superbly choreographed action sequences, and an excellent ensemble cast with the likes of Sam Rockwell, Bryan Cranston, Catherine O’Hara, Ariana DeBose, and a seriously underused Richard E. Grant, not to mention fine turns from Howard and Cavill as alter-egos of one another. This one isn’t nearly as bad as many critics have made it out to be, but it could have been substantially better with some significant retooling and judicious editing. “Argylle” apparently has ambitions to become a new franchise, too, but we’ll have to see if that materializes based on what kind of box office draw it ultimately produces. At this point, though, I think it has its work cut out for it.",5.0
Argylle,Chris Sawin,"_Argylle_ is an action thriller that willingly wallows in goofy, cringey nonsense. Its writing is immature, and its action is overloaded with sloppy CGI and outrageous concepts that are preposterously frustrating.

**Full review:** https://bit.ly/arghspy",4.0
Argylle,r96sk,"Such a peculiar film. Everything about it feels off.

I was initially a little unsure as to what I thought about <em>'Argylle'</em>, but in the end: it's a no from me. I couldn't actually tell you one thing that I properly liked about this, like at a push Sam Rockwell and Bryan Cranston are decent but even they get a bit hit-and-miss. There's just a constant tinge of lousiness that follows around throughout.

Bryce Dallas Howard feels miscast, even if she is fairly likeable. Henry Cavill is wooden (intentionally? doubtful), as is Dua Lipa but the musician has enough charm to make it work slightly. Speaking of music, all that is used here is alright but again feels off - mostly seems like the correct type of song, just the wrong exact choice of song... ""Electric Energy"" might grow on me, though.

What also doesn't help is the unavoidable feeling that it is a bad redo of <em>'<a href=""https://letterboxd.com/films/in/kingsman-collection/by/release-earliest/size/large/"" rel=""nofollow"">Kingsman</a>'</em>, which is expected given who directed this and all that they are planning with the two flicks behind the scenes. I'm all for a shared universe, though this is perhaps too on the nose. There are also <em>'<a href=""https://letterboxd.com/film/the-lost-city-2022/"" rel=""nofollow"">The Lost City</a>'</em> (itself echoing <em>'<a href=""https://letterboxd.com/film/nims-island/"" rel=""nofollow"">Nim's Island</a>'</em>) vibes sprinkled in too. Another negative is the special effects, especially at the start... less said, the better.

Overall, I think it all boils down to being a poor film - unfortunately, as I kinda wanted to like it but simply couldn't. Actually, it's just come to me, I just remembered a scene I actually did truly enjoy: the one with Leona Lewis' ""Run"" track. That was actually entertaining.",5.0
Argylle,MovieGuys,"Cringe worthy nonsense, loaded down with puerile premise after puerile premise, predictable, done to death action and irritating characterisations. 

I managed about half of this before walking away. The US entertainment industry really is a bit of a bad joke these days.",4.0
Dune: Part Two,Manuel São Bento,"FULL SPOILER-FREE REVIEW @ https://talkingfilms.net/dune-part-two-review-the-new-generational-epitome-of-sci-fi-epics/

""Dune: Part Two surpasses even the highest expectations, establishing itself as an unquestionable technical masterpiece of blockbuster filmmaking.

With a narrative that deepens the complex web of political relationships, power, faith, love, and destiny, it not only provides a breathtaking audiovisual spectacle, thanks to the genius of Denis Villeneuve, Greig Fraser, and Hans Zimmer, but it also offers a profound meditation on universal human themes through thematically rich world-building and thoroughly developed characters. The superb performances of the entire cast, led by a career-best Timothée Chalamet and a mesmerizing Zendaya, further elevate this incredibly immersive cinematic experience.

It warrants comparisons with the greatest sequels in history, easily becoming the new generational epitome of sci-fi epics.""

Rating: A+",10.0
Dune: Part Two,r96sk,"As anticipated, a thrilling watch!

I enjoyed <em>'Dune'</em>, though remember thinking it was obviously a complete set-up to a sequel and that this would only improve upon its predecessor - and that's very much the case. <em>'Dune: Part Two'</em> is excellent! My interest did wane slightly at roughly the middle part, as was similarly the case with the first film in truth, but that was a feeling that only lasted for a relativiely short time.

All in all, it's fantastic. The acting is top notch, the visuals are breathtaking <em>(those sandworms tho)</em> and the score is outstandingly hefty - you can always rely on the great Hans Zimmer! Timothée Chalamet stars yet again, as do the likes of Rebecca Ferguson, Zendaya, Dave Bautista & Co. The person I actually enjoyed most on screen was Javier Bardem, who is truly brilliant throughout. 

Bring on <em>'Dune Messiah'</em>! On that note, happy to read that director Denis Villeneuve has noted that he won't be rushing that one out - and rightly so!",9.0
Dune: Part Two,CinemaSerf,"This is certainly a great looking film to see on a big screen with some really effective, almost industrially sounding, audio - but what happened to the story? It's wafer thin and really stretched out for 2¾ hours. We pick up with ""Paul"" (Timothée Chalamet) and his mother (Rebecca Ferguson) trying to convince the ""Fremen"" that they are worth the hassle. Fortunately, leader ""Stilgar"" (Javier Bardem) is convinced of the messianic state of the young refugee, whilst their own reverend mother is on her last legs which might give ""Jessica"" a chance to prove her own worth, and provide an opportunity to peddle some embellished mythology about her son's ascendant propheteering. All of this manoeuvring and politicking is having quite an impact on ""Chani"" (the under-used Zendaya) and on the relationship between her and the increasingly worshipped new Duke. Meantime, now fully reinvigorated and emerged from his bath of recuperative Guinness, the evil ""Baron Harkonnen"" (an almost Zeppelin-like Stellan Skarsgård) has recruited his lethal nephew ""Feyd-Rautha"" (Austin Butler) to get to grips with the rebellion on ""Arrakis"" that is bringing him into the gaze of an ill-satisfied emperor (Christopher Walken). Battle lines are drawn! Now whilst I did enjoy this, the rest of the film is a gloriously photographed but slowly paced hybrid of ""Khartoum"" (1966) and ""Lawrence of Arabia"" (1962) with a bit of the ""Phantom Menace"" (1999) thrown in for good measure. The acting is adequate but the characterisations are all too routinely sacrificed at the altar of the stunning visuals and from about an hour to go, I was convinced this this was but part two of three (or maybe even more). Walken and Charlotte Rampling feature all too sparingly to make much difference, indeed even Zendaya's warrior-like tendencies seem to have been neutered rather and I though that Chalamet just tried far too hard to imbue his character with a strength that he was far more successful with first time round. That said, it does work well enough as a classy and well produced sci-fi adventure with plenty of action and mysticism but I needed more meat on it's bones. I still get distinctly squeamish when I watch what they do with the water, let alone where they get it from!!",7.0
Dune: Part Two,Chandler Danier,Great but a little long. Sexier than LotR and no hair. Yell acting. Jabba bathes in black goo and kills women horribly. Walken is hilarious. Zendaya still an addict. Bridges is a bit self-serious. Amazing visuals. Really enjoyed...was glad and a bit bored by the end. Shorter Dunes please.,9.0
Code 8 Part II,MovieGuys,"The first Code 8 movie, was never going to be an award winner but at least it had an element of danger, pacing and excitement. 

Regrettably, its sequel, seems to be more a vehicle for woke tropes than  an actual sci fi film. It appears to be mostly about people from diverse backgrounds being either abused by ""the system"" or co-opted into it, as state sponsored abusers. 

The results feels like what it is. A moral statement viewed from a particular point of view, rather than an exciting, sci fi film, which is what, in this reviewers opinion, it should have been. 

Its slow paced, not terribly exciting and really goes nowhere interesting but then, how could it? 

In summary, I, for one, am sick and tired of having simple escapist entertainment hi-jacked to peddle a specific world view. That is what activism and social commentary are for. Of course, the irony too, is the harder this kind of thing is foisted on people, in my experience, the more they tend to reject it.",4.0
Code 8 Part II,Chandler Danier,This was a lot of Code 8 to watch in a short period of time. I definitely skipped through large portions of this film. It seemed like the first film. I maybe should not have watched the first film. Aibo was a dumb idea. Super cute and sweet ending. Fun sequences. A little long.,6.0
Poor Things,Manuel São Bento,"FULL SPOILER-FREE REVIEW @ https://fandomwire.com/poor-things-venice-film-festival-review-emma-stone-shines-in-the-best-film-of-the-year-so-far/

""Not only is Poor Things the best movie of the festival, but it's also the best of the year so far, as well as a new personal favorite of Yorgos Lanthimos' career.

A brilliantly thought-provoking, insanely hilarious story packed with substance, focused on a fascinating self-discovery journey filled with thematically rich layers. Astonishing performances from the entire cast, but Emma Stone is truly impressive as an exceptionally expressive force who should win many awards.

A technical masterclass across all filmmaking areas simply puts the icing on top of a near-perfect cake.""

Rating: A",9.0
Poor Things,Brent Marchant,"When the circumstances of our lives don’t suit us, it’s time to reinvent ourselves – something that happens both literally and metaphorically in this latest offering from director Yorgos Lanthimos. But the way that result comes about here represents a truly inspired fusion of genres, including comedy, romance, social commentary and sci-fi, making for one of the most inventive, unusual and hilarious releases of recent years. This offbeat feminist fable tells the story of how a pregnant, young, anonymous suicide victim (Emma Stone) is reanimated with the aid of a brain transplant from her unborn fetus, an achievement accomplished by a colorful, controversial but well-meaning surgeon/scientist a la Dr. Frankenstein (Willem Dafoe). He nurtures his subject back to life, health and sentience, a sometimes-challenging process that finally surfaces when she discovers sexuality, the trigger for exploring a new, independent life for herself, both physically and emotionally. Through a series of adventures over the course of a trip through Europe with a free-wheeling, lusty but lecherous, self-serving lawyer (Mark Ruffalo), she finds herself as a self-actualized woman in an age where that’s more of a rarity than a standard, particularly in a world where men treat women more like property than people. While the film’s pacing could use some shoring up in the middle, this offering nevertheless entertains with uproarious laughs throughout, even when the narrative turns more thoughtful and substantive. The superb performances by Stone, Dafoe and Ruffalo are top shelf, contributing to the picture’s whopping 13 Critics Choice Award and 7 Golden Globe Award nominations. The film is also visually stunning in its cinematography and editing, as well as in its spectacular and whimsical production design, filled with images reminiscent of the movies of Wes Anderson and Terry Gilliam while sustaining a look all its own. Admittedly, this release features a good deal of explicit sexuality, both visually and in the dialogue, so sensitive viewers should take note. However, as one of the most anticipated pictures of this year’s awards season, “Poor Things” never disappoints, serving up a solid offering that consistently tickles the funny bone while giving audiences much to think about – and there’s nothing poor in any of that.",8.0
Poor Things,CinemaSerf,"It's almost as if Yorgos Lanthimos had sat down for a transcendental conversation with James Whale! Student ""Max"" (Ramy Youssef) is a student recruited by his professor ""Godwin"" (Willem Dafoe - aka ""God"") to come and help him work on his latest project. She's called ""Bella"" (Emma Stone) and it soon transpires that she is the product of some very creative surgery on the part of ""God"" - a man who has, himself, had one or two experiences under the knife at the hands of his scientist father! You see, a pregnant woman took her own life by jumping from a bridge, but was luckily fished out of the water before her baby died. The surgeon managed to deliver the baby then replace the dead brain of the adult with the one from the nascent infant! Needless to say, ""Bella"" is on an actively steep learning curve and is quite capable of throwing the odd tantrum to get what she wants - and that is, initially, to go out and explore. Gradually more empowered, and a little more mature, she discovers the delights of the orgasm - and after that there's no stopping her. ""God"" tries to control her by suggesting a marriage to ""Max"" but he insists on such a fastidious contract that ""Duncan"" (Mark Ruffalo) concludes she must be worth investigating. He meets her and offers her her dreams, she convinces ""God"" to let her go with him and soon she is embarked on a trip around Europe enjoying the frequent delights of ""furious jumping""! The always learning woman soon tires of her beau, and realises that she can have loads of fun and earn at the same time - before ""God"" falls ill and she must return home to not just that life, but surprisingly to the one she thought she had left behind on the bridge. This film is genuinely laugh-out-loud at times, and the performance from Emma Stone has to be her best. She plays the almost porcelain-like and childish ""Bella"" when we meet her expertly, and that skill prevails as her character evolves into a savvy, street-smart and capable woman who quickly learns to fight fire with fire. Ruffalo is also on super form as her travelling companion and Kathryn Hunter also turns in a solid performance as her Parisian paymaster ""Swiney"". The narrative takes us on a fantastic tour of European cities, but also on a wonderfully evocative tour of humanity - warts and all. ""Bella"" has a practical and analytical mind that at times seems ludicrously detached, then somehow she ends up having got it right all along. It might look a bit long at just shy of 2½ hours but it really flies by and I couldn't help but feel sorry for the poor billy goat at the end of this creatively interpreted and very well adapted story of what were originally supposed to be Glaswegian hotspots!",7.0
Poor Things,r96sk,"Superb! It's quite the ride!

I don't have the film school-esque analysis to adequately describe all this, so I'll very much leave that to others. What I can note, though, is that I had a great time watching <em>'Poor Things'</em>. It's incredible. I have many a positive, though the main one is obvious: Emma Stone. All I can say is: Bravo! A truly outstanding performance!

Another major, major plus is the music. Wow! Sensational. It's so commanding throughout, blowing me away in what felt like every few minutes... and yet, it never distracts or takes you out from any scene unfolding onscreen. One of the greatest scores I've heard in a very long time. That aside, the visuals are amazing - from the colours to the sets, major props to all those behind the scenes. It all looks exquisite.

Stone isn't alone in impressing, as Willem Dafoe is brilliant too - loved his showing in this, the accent is particularly well fitting. Mark Ruffalo is praiseworthy too, as is everyone else to be honest - e.g. Ramy Youssef and Kathryn Hunter. They all partake in a quite bizarre plot, but one that is absolutely absorbing from beginning to conclusion.

Pre-watch I was somewhat expecting that this was going to be one of those (having not researched anything, as per) overly artsy flicks that I wouldn't connect with, delightfully I was totally wrong. I also felt, when Christopher Abbott's character appears, that the film should've ended earlier, though again I was incorrect because the film simply manages to continue at such a hugh quality.

To wrap it up: I loved it. Credit to all involved.",10.0
