movie_title,reviewer,review,rating_given
The Zone of Interest,MovieGuys,"The Zone of Interest takes the notion of the ""banality of evil"", back to its true origin, the family home. 

All human evil starts with a home. In this instance, the home of a concentration camp commander, Rudolf Höss, of Auschwitz and his family. The laid back ease of middle class family life, of an upper management level Nazi, is juxtaposed with suffering of people (Jews, gypsies, homosexuals, political dissidents, religious minorities and yes even some allied soldiers, who were prisoners of war), who quite literally reside, over the fence, in the concentration camp, Hoss oversees.

This is a quietly horrifying film where the an idyllic and wholly familiar family setting is punctured, by the occasional sounds of misery and death, emanating from neighbouring death camp. Smoke stacks, burn human remains, that rise beyond the family fence line. In another compelling scene, a Hoss family riverside outing is disrupted by human ash, floating with the waters current.

The Zone of Interest is not an demonstrably violent film. Violence is hinted at and as we can see, is psychologically and physically partitioned off, from the peaceful home life, of Hoss and his family. 

This is a compelling film but I did feel it overplayed its hand somewhat with discordant music and oddly dissonant night vision scenes, with a girl apparently trying to help the victims of the camps, by leaving food for them, at work sites, concealed next to their tools. 

In summary, a disturbingly influential film, that looks openly and honestly, at where evil resides.",8.0
Anatomy of a Fall,Lachlan Thiele,"<b>INT. THE ANATOMY OF ANATOMY OF A FALL - DAY</b>
<i>Anatomy of a Fall</i> is an excellent film crafted from the mind of Justine Triet. It's beautifully acted, shot, scored and edited together. So let's look at the Anatomy of <i>Anatomy of a Fall</i>.
 
Story:
The story revolves around the unconfirmed cause of death of <i>Samuel</i>, who has fallen out of his attic window. The only person in the house was his wife <i>Sandra</i>, <b>Sandra Hüller</b>, the prime suspect. Their son <i>Daniel</i>, blind from an unfortunate event, is the only witness. The story is from the perspective of <i>Sandra</i>, and just like any courtroom drama, details are revealed over time. Fortunately, it's at a steady pace, never announcing too much or too little, giving us the correct information at the right time. While I'm mostly positive about the story, some moments slow right down, and we come to a standstill; overall, thanks to the following few components, they considerably make up for the story's flaws. 

Performance: 
Its lead is <i>Anatomy of a Fall's</i> greatest asset, <b>Sandra Hüller</b>. She is tremendous, pulling no punches in the role of Sandra, the deceased's wife. For the rest of the cast, no one except the dog is ever greater than Sandra! 

Cinematography: 
The camera in this film is on a swivel, always moving, keeping us engaged. The camera uses Visual humour quite a bit, which is always great to see. Finally, the colour grade felt natural and, at times, warm, giving a homely vibe. 

Score:
A simple piano piece plays throughout the film; it is excellent. 
Finally, the editing:
This was a stand-out for me. It was cleverly cutting at points to hide us from the horrors but holding onto moments before it became too much. 
There's a lot of love about this film — a highlight of the Cannes 2023 run. 

<b>FADE OUT.</b>",8.0
Anatomy of a Fall,CinemaSerf,"When young ""Daniel"" (Milo Machado Graner) returns from a walk in the snow with his dog (""Snoop"") he discovers the body of his father lying on the snow in front of their alpine house. He shouts for his mother, writer ""Sandra"" (Sandra Hüller) and soon the police investigation is out to establish just what happened. What do we know? Well, not a lot really - just that before the young man left for his stroll, his mother was giving an interview in their kitchen to a journalist that was being increasingly drowned out by the intrusive music emanating from her husband upstairs, and - that young ""Daniel"" is blind. ""Sandra"" enlists the help of a friend who represents her as after many a re-enactment the authorities conclude that there is enough evidence that she lobbed him over the balcony and murdered him. A curiously relaxed courtroom drama now ensues. Those of us used to watching British or American scenarios like this might find the approach, usually entirely speculative, taken by prosecuting counsel to essentially draw his own conclusion from evidence that may or not be there is quite entertaining to watch. The President of the tribunal rarely intercedes in what becomes a frequently unsubstantiated analysis of the sometimes turbulent marriage of the two, we learn of the cause of the boy's blindness, of his mother's sexuality and by the denouement I felt that Justine Triet had worked well with a strong cast to create a whodunit where there might have been no crime at all! That denouement is a little rushed, but leaves a lovely degree of doubt in the mind of the one member of the cast who probably needed convincing the most! It's just a shade too long, a wee bit too much build up, but once it's in full swing this is a strongly performed, sometimes quite funny and dark crime drama that is well worth a watch.",7.0
Anatomy of a Fall,Brent Marchant,"It’s always disappointing when a film aspires to greatness that it never achieves. Such is the case with the latest offering from French writer-director Justine Triet, whose allegedly suspenseful thriller is about as appetizing as a plate of tepid leftovers. This crime investigation/courtroom drama about the mysterious death of a middle-aged unsuccessful writer (Samuel Theis) who falls from the second story of his mountain chalet looks into whether his demise is due to suicide or murder, with his wife (Sandra Hüller), herself a best-selling author, being the prime suspect. Despite an intriguing premise, however, the movie is overlong, needlessly talky and inherently flat, with a cold, clinical, unengaging narrative and characters who engender no connection, compassion or empathy. In essence, this is a “whodunnit” that plays like an extended “whocares.” Fault the screenplay here, which seeks to tell a tale in the same gripping vein as such great courtroom dramas as “Anatomy of a Murder” (1959) but that never achieves the level of tension, mystery and audience engagement needed to pull that off. The meticulously orchestrated script feels calculated and derivative virtually from start to finish, especially in its trial sequences, which explore an array of possible motives and explanations, including everything from infidelity to plagiarism to previous suicide attempts, that rely on often-implausible speculation and inflated conjecture to carry forward a proceeding that probably never should have ended up in court in the first place. What’s more, the double entendre that is the picture’s title is so obvious that any hopes of nuance, subtlety or profundity evaporate quickly once the failing nature of the couple’s troubled relationship surfaces. While the film admittedly features a fine performance by Hüller, it’s far from enough to rescue a picture with big aspirations that never pan out. How this release has garnered so much exaggerated awards season buzz is beyond me, especially given its intrinsically insipid, underwhelming, overstated character. There are plenty of other films of this ilk out there that are far more worth watching than this one, so grab one of those better selections instead and give this one the well-earned pass it genuinely deserves.",6.0
Anatomy of a Fall,BornKnight,"French movie with a drama / courtroom theme that is gripping more into it's realistic tone than others movies that create unexpected and unbelievable tones, directed by Justine Triet from a screenplay she co-wrote with Arthur Harari (Onoda: 10,000 Nights in the Jungle).

Currently it is the winner of Canne's Palm D'or and nominated for five Academy awards, being those Best Motion Picture of the Year, Best Achievement in Directing, Best Performance by an Actress in a Leading Role, Best Original Screenplay, Best Achievement in Film Editing. 

It tells the story of In an isolated mountain chalet near Grenoble, where the problematic couple French Samuel Maleski is playing music in his attic so loudly that interrupts an interview of his German wife, Sandra Voyter (played by Sandra Hüller), and son Daniel (partially blind), returns from a long walk with his guide dog Snoop to find Samuel dead below his attic window. 

From there and all the theories, criminal analysis and courtroom judicial processes guide the movie and gain the midia of the country. Do not expect CSI level invention on this one - it is logical and reasonable as a movie that analyses the crisis in the couple and the impact on the son with a heavy focus on the courtroom that gabs your attention.

Sandra Hüller is the protagonist that leads with an incredible performance on her role. The direction is solid as well as the screenplay. The cinematography varies from formal takes to more active ones and the editing is perfect in joining all the takes.

I usually found courtroom movies to be boring but this wasn't the case that holds your attention till the end even with the slow moving of events and investigations from the live of protagonists to the dispute of the lawyers.

A strong contender for all the prizes but knowing the academy I am almost sure it will grab 2 to 3 prizes.

From my point of view the movie is a 8,5 out of 10,0 / A. For sure one of the movies of 2023 that must be seen, so it gets a like from me too.",8.0
Dream Scenario,Brent Marchant,"Packing a lot of material and ideas into a single film can result in a muddled, confusing mess, no matter how well-meaning a filmmaker’s intentions might be. However, in his third feature outing, writer-director Kristoffer Borgli succeeds for the most part when it comes to tackling such an imposing task. This offbeat tale of tenured but underappreciated university professor (Nicolas Cage) takes viewers on a wild ride through the diverse realms of fame, metaphysics, cancel culture, unrelenting group think, and unexpressed, underpursued desire, and the downside consequences of each. All of this comes about when the middle-aged everyman protagonist inexplicably begins showing up in the dreams of countless people, many of whom he doesn’t even know. This curious oneiric anomaly – an inspired metaphor for one’s presence on social media and in the public eye – quickly transforms him into an overnight viral media sensation, one that starts off with a generous showering of attention and lustful admiration but that almost as quickly leads him to become a scorned put-upon pariah. He swiftly becomes more than just yesterday’s news; he turns into the object of a targeted campaign of cancel culture, hate speech and unapologetic ostracism. And, ironically, it all stems from something he never wanted nor asked for in the first place (at least in the form it ultimately took). From the foregoing description, it might sound like the filmmaker has tried to overstuff this vehicle with far too much material for viewers to process and comprehend, and there are points in the story (especially in the last half hour) where a good case could be made for that argument. However, in telling this allegorical fable, the director manages to keep the narrative’s ideas distinctly sorted and in context to drive home his message, a powerful cautionary tale about the point we’ve collectively reached as a society with respect to these powerful and potentially damaging matters and practices. These are notions that we all need to hear but seldom do because of all the noise surrounding us that prevents us from hearing the music because of all the notes. For all this seriousness, however, “Dream Scenario” is loaded with hilarious, laugh-out-loud humor and fine performances all around (especially Cage and Michael Cera as an empty-headed, self-absorbed brand management expert), complemented with skillful film editing and carefully selected incidental shots that effectively punctuate the mood of many scenes. The script is generally solid, too, though it begins to stray somewhat from the material that works best in the final act, and there are a few graphically violent sequences that sensitive viewers should be wary of. On balance, though, this is the kind of production that should be made in greater numbers in an age where so many of us have lost touch with reason, our existence and ourselves. Maybe watching an offering like this could help us all sit up, think and get back on track while we still can.",8.0
Dream Scenario,CinemaSerf,"When college professor ""Matthews"" (Nicolas Cage) starts appearing in the dreams of strangers (oh, and his wife!), his whole life is turned topsy-turvy. Initially it's all a rather benign phenomenon with his appearances fleeting, inconclusive and harmless. Until, that is, he meets one person who has been having a rather more intimate experience. Not only does this meeting not go very well (on various levels!) but it seems to change the very nature of the illusions for everyone, turning them more into nightmares... A predictable, occasionally violent, backlash ensues which makes the man's life - and that of his family - all but insufferable. What to do now his fame has come back to bite him? I quite enjoyed the first half hour of this quirky and entertainingly written drama. Cage is always rather good at taking the rise out of himself, and he seems to be enjoying the ride at the start. Once the story turns a bit darker, though, it runs out of steam. It's charm and uniqueness becomes rather subsumed in a rather unsubtle whack at the ""cancel culture"" that exists amongst those who live their lives via social media. It's not the first or the best to draw a parallel between what's real and what's fact - even when such distinctions are easily identifiable, and after a while I felt the film had no clear idea of how to conclude without actually proving it's own, rather depressing, point. The idea is interesting, the delivery is fine - but the end product is all a bit underwhelming.",6.0
Dream Scenario,BornKnight,"It must be not the most original movie but hey, it is something unexpected. Being from A24 I did what I do on almost all movies - didn't read anything about it beforehand. 

After watching the movie and taking my conclusion, I researched a bit about it: it is a black comedy movie from the norwegian (ok strange film spoiler) Kristoffer Borgli produced by Cage and Ari Aster. Ok, this also got my attention: the director has only 3 movies with this one, being the last one ""Sick of Myself"" (2022) literally the opposite of what this one talk about - a satyre of cancel culture in a mildly surrealistic way (maybe there also enters a pun later in the movie about France). 

He is a normal biology professor that starts popping into millions of people dreams and gains notoriety just to be the the fruit of nightmares and start to be cancelled by the society.

The base of the acting is the ""good actor version"" Nicolas Cage as Paul Matthews, a college professor and Julianne Nicholson as Janet Matthews, Paul's wife. Other recognized actors like Michael Cera in minor papers. 

The cinematography by Benjamin Loeb (""Mandy"", 2018, ""Pieces of a Woman"", 2020, ""After Yang"" 2020) is very effective especially in the use of angles. On the soundtrack, that is very adequate without any music other than OST the last music (credits one) City Of Dreams by 
Talking Heads is very nice.

But the real deal with the movie aside from the theme and story is Nicolas Cage in another good role, Thanks God for that.

On my score, not a movie for everyone, only those who enjoy northern Europe cinematography, a solid 7,5 out of 10,0 / B+ - I am sure you can call the story something you've seen before.",7.0
Dream Scenario,Chandler Danier,"Only Cage can create such an awful, self-centred person on screen and maintain relatability. He is incredible. Creative little woke-sterpiece giving an unbelievable twist to some modern issues that results in tragic comedy.",9.0
Imaginary,CinemaSerf,"Anyone remember an half-naked Tom Payne getting pulled into a barrel of hookers by Stellan Skarsgård in ""the Physician"" (2013)? That vision might just have forgiven this film had he featured a bit more, but clearly he had read the derivative script and decided it only merited one filming day - hence he hardly features at all. What does feature is the usual dysfunctional family malarkey with him newly married to the well-meaning animator ""Jessica"" (DeWanda Wise) who is trying to stay on friendly terms with his two daughters - the teenage ""Taylor"" (Taegen Burns) and the younger ""Alice"" (Pyper Braun). The family decide to move into her father's house - he is now in a care home - and quickly the youngest discovers a bear. Yep - a teddy bear. What can go wrong? Well it isn't a very nice bear, indeed it's distinctly malevolent and is soon trying to lure all of them (except Tom who has fled the proceedings by now) into a parallel reality with lots of rooms containing lots of scenarios. Some benign, so less so. Poor old ""Jess"" is soon at her wits end but fortunately neighbour ""Gloria"" (Betty Buckley) is on hand with some pearls of wisdom that might help them through this rapidly menacing quagmire! Or will they? This film plays out exactly as you would expect. There isn't an original bone in it's body, the acting is mediocre at best - but wait, it's nowhere near as banal as the extracts from the Janet & John book of horror film writing. Some of the dialogue here really does have you staring at the cinema ceiling in disbelief. It's another standard Blumhouse offering that passes the time without you having to engage your brain in the slightest - in fact, you could just watch the last ten minutes and miss very little from the rest of it.",5.0
Imaginary,r96sk,"Pyper Braun merits praise, <em>'Imaginary'</em> otherwise falls flat.

I was never locked into the story and I didn't really care for the characters at any point, even Braun's Alice isn't all that interesting despite a rather great performance from the young actress. DeWanda Wise is a bit dull, while Tom Payne disappoints somewhat - I mean he only has a small role, sure, but his acting is unconvincing... and I know he can actor far better, as seen during his time on TV's <em>'<a href=""https://en.wikipedia.org/wiki/The_Walking_Dead_(TV_series)"" rel=""nofollow"">The Walking Dead</a>'</em>.

The antagonists in this are poorly utilized, the poster bear is prevalent but very boring. It needed a Chucky-esque portrayal, rather than the blank stare we get every few minutes. The ending also drags, I thought it was going to end sooner a few times but it kept finding new ways to stick around; nothing majorly grating, granted. The score is at least OK.

It also, amusingly, took me ages to work out what the bear's name was. I'm not familiar with the name ""Chauncey"", so genuinely for the longest time thought the name was either ""John C"" or ""Shaun C"". It was only when I finally noticed it written down visually that I realised! 😂

In conclusion, credit to Braun but everyone else onscreen and off it could've done better in my opinion.",5.0
Perfect Days,BornKnight,"Coproduction between Japan and Germany, directed by the german director Wim Wenders (Texas Paris, Wings of Desire among others) and written by him and Takuma Takashi.

It won the Cannes Film Festival 2023 for Best Actor and Ecumenical Jury
 and it is nominated for Academy Best Foreign Movie (my favorite for this category).

It tells some days at the life of a public bathroom cleaner at Tokyo, interpreted by Koji Yakusho Hirayama, as Hirayama, his daily routine and 4 events in between his usual days. It also shows how some people treat those invisible workers even in a modern civilized country as Japan.

Hirayama have a simple, but happy life as he is and what his does with the maximum commitment - it is a marvelou movie about contemplation and what simple things and events can bring of happiness in the life, if you allow it.

The cinematography is by Franz Lustig (Anselm), and it is beautiful in using the available light and daily variations, mostly in shots with the protagonist.

With a slow minimalistic story focused on this philosophy and camera work also directed to the architecture of public bathrooms, it may not be a movie for everyone.  

My score for it is 9,6 out of 10,0 / A+.",10.0
Perfect Days,CinemaSerf,"Now I don't now about where you live, but in my town you are lucky to find a public toilet at all, let alone one with designer fittings and miracle blinds! Luckily, Tokyo has a dedicated and meticulous cleaner in ""Hirayama"" (Koji Yakusho) whose routine gets him from bed, via the coffee machine, to his rounds, the bath house, then his book and again to bed. Helped, occasionally but not too reliably, by the younger ""Takashi"" (Tokio Emoto) his joy when travelling from site to site is to listen to old cassettes from the likes of the Doors and Van Morrison. He is an outwardly rather humourless man, and he likes his daily pattern, so imagine his surprise when he returns home one evening to discover his niece. ""Niko"" (Arisa Nakano) has absconded from home and decided to come stay with him for a few days. With his pal at work having a new girlfriend to impress and now him a teenage niece to accommodate, his life faces a turmoil and we have to watch (and hope) as he tries to get through it. Who knows? Maybe it will help bring him out of his self-imposed shell? Might we find out what caused that introspection in the first place? There's quite a lot of repetition here, but as each day goes by Wim Wenders introduces us to a little more. More about the city, more about the characters and maybe just a little too much about multi-purpose bleach. Yakusho is perfect for his part and he engagingly delivers a characterful performance as a man who prefers not to speak and the whole drama evolves, gently, to not so much a conclusion as another day that may or may not be different from the previous ones.",7.0
One Life,Manuel São Bento,"FULL SPOILER-FREE REVIEW @ https://fandomwire.com/one-life-bfi-london-film-festival-review-a-must-watch-important-wwii-story/

""One Life is yet another important story from WWII that deserves to be seen on the big screen.

Despite not breaking genre barriers, it unfolds its narrative in a captivating manner, packed with devastating, bittersweet moments, but also filled with wonderful depictions of altruism, humanitarian sacrifice, and hope, culminating in a powerfully cathartic ending that serves as an ideal tribute to Sir Nicholas Winton.

The cast carries the weight of the responsibility of the rescue mission with grounded care, relying on the legendary Anthony Hopkins to bear the explosion of the accumulated emotion.

Beautifully edited, tear-inducing score... simply a must-watch.""

Rating: A-",8.0
One Life,CinemaSerf,"Johnny Flynn performs quite well here as the young stockbroker Nicholas Winton who arrives in Prague just as the Nazis annexe the Sudetenland. He is horrified by the child poverty that he sees and decides, perhaps naively, to work with his British Refugee Council colleagues to try and expedite their removal to a safer and altogether earthier environment. Fortunately, his mother Babette (Helena Bonham Carter), herself from immigrant stock, is no slouch when it comes to doorstepping officials in Whitehall and soon has convinced the authorities to agree a fast-track mechanism that will enable him to get the children back to the UK provided they have guaranteed foster homes and the fairly massive sum of £50 as a guarantee. He returns to London and a massive public awareness/fundraising campaign ensues - as do eight trains carrying over six hundred children to safety. We are told this story via a series of flashbacks from the modern day Winton (Sir Anthony Hopkins) who now lives peacefully with his wife Greta (Lena Olin) in Berkshire. He is perusing a scrapbook he has left in a drawer for forty-odd years in which he has photographs and details of many of those passengers on the ""Kinder"" trains. His friend from back then (Jonathan Pryce) manages to put him in touch with Betty Maxwell - the wife of the wealthy publisher Robert, and next thing he is on British television's most popular ""That's Life"" programme that regularly reached 18 million people on a Sunday evening. This appearance poignantly introduces him to one survivor, his next sees that snowball into some sixty or so who owed their life and liberty to the efforts of Winton and his colleagues - whom he is always very clear to ensure are never forgotten. I recall watching this programme back in the day and the dramatisation is no less moving than the original broadcast. Sir Anthony offers us a considered performance - demonstrating a shy family man who rejects the trappings of fuss and celebrity because he sees his behaviour as nothing special. Doing the right thing. His efforts are touching and understated and nicely dovetail with the rather pushy and forthright Bonham Carter fighting tooth and nail against red tape in 1939. As an insight to Nazi tyranny it also works subtly. We see very little actual violence, but we see a squalor and hopelessness that robs the soul of hope as depressingly as the situation robs their stomachs of food. The film looks good and is sparingly scripted allowing our own imagination to do much of the thinking here.",7.0
