movie_title,reviewer,review,rating_given
The Teachers' Lounge,Brent Marchant,"In recent years, we’ve all seen examples of incidents that start out comparatively small but that quickly get blown all out of proportion – and unreasonably so at that. As developments emerge and explode under these conditions, they often lose all sense of rationality and soon take on lives of their own, expanding into tangential and seemingly unrelated areas that have virtually nothing to do with the event that spawned them. And, in the end, we’re left with outcomes that seem inappropriate and ill-suited to what launched these insane scenarios in the fist place. That’s what writer-director Ilker Çatak explores in his latest offering, a dramatic satire about what unexpectedly grows out of a case of petty theft in the teachers’ lounge at a German middle school. Before long, the victim in this incident (Leonie Benesch) becomes swept up in a very public dust-up that leads to her becoming a very public pariah in the eyes of her peers, her students and their parents, while those in official capacities sit on the sidelines and do virtually nothing to address the issue. The situation thus serves as a microcosmic metaphor for what’s happening on a wider scale in society at large today, drawing in such ancillary elements as racial and national prejudice, the incendiary role of the media, the impact of unsubstantiated innuendo, the protection of personal privacy, the indulgence of contemporary youth, and the sway of fake news in shaping public opinion, a rather full plate of dubious and unsavory fallout stemming from comparatively meager beginnings. While some may contend that these outcomes are somewhat exaggerated in nature, they nevertheless collectively draw attention to undeniably troubling issues desperately in need of attention in our increasingly out-of-control world, global concerns that obviously transcend national borders, all punctuated here with more than a few hefty infusions of wickedly absurdist humor. “The Teachers’ Lounge” might not appeal to everyone, but, for those who enjoy films that aren’t afraid to present biting social commentary, this should be added to your watch list. As the picture so sadly shows, even supposedly civil environments aren’t immune from the kind of social nonsense depicted here, a troubling teaching for all of us who are looking for a return to sanity in an increasingly crazy existence.",8.0
The Teachers' Lounge,BornKnight,"German drama film directed by İlker Çatak, and that is nominated for best international movie for the 96th Academy Awards.

Leonie Benesch as Carla Nowak, and idealist Polish immigrant teacher have a suspicion of theft at her 1st grade school raised by one of the student towards another (immigrant Turk) student.

After this incident and the reunion with the father of the boys she withstands another small theft at the teacher lounge, and after that she decides to mount a trap to confirm her suspicions putting her coat with the wallet and some money and laptop to film. The money is stolen but only the sleeve of the robber is seen - the sleeve with a unique painting that another functionary on the teacher lounge uses, and she aboard her (that is mother of another immigrant student).

From this pretext the movie delves into a suspicion web mixed with xenophobia and student pro and against the late case boy that divide opinions and breaks the fragile peace that the school once had, including with some more radical students that oppose order and make false statements.  

The movie is engaging and the web of suspense got me till the end, and it is a nice entry to best international movie. I would rate it a 8.0 out of 10 / A - as a whole.",8.0
The Teachers' Lounge,CinemaSerf,"There's a spate of petty thefts going on in her junior school, so after a rather dubiously executed class search fails to deliver a culprit, the enthusiastic and maybe a little naive teacher ""Miss Novak"" (Leonie Benesch) sets a video trap to see if she can identify the culprit. She does, potentially, identify someone going through her pockets and headmaster ""Böhm"" (Anne-Katrin Gummich) now tries to deal with a scenario that rapidly spirals out of control and reveals an increasing degree of toxicity for not just this teacher, but for relationships at all levels throughout the school - as well as a fairly counter-productive environment of red-tape. We are soon facing a stand-off situation that borders on the criminal with some surprisingly potent battle lines soon drawn both inside and outside of the teacher's lounge. I had credibility issues with what happens now. It's not that the drama isn't well acted and tautly directed, indeed the young Leonard Stettnisch's portrayal of her student-cum-antagonist ""Oskar"" is really effective. It is just that too much of what occurs struck me as preposterous. Any procedures in place to protect teachers and pupils seems to gave been chucked under the dramatic bus and the absence of police or qualified investigative authorities here just didn't ring true as we made our way to a denouement that I felt rather underwhelmed. It's gripping, and well worth a watch - but plausible? Hmmm, I'm not so sure.",6.0
Deep Sea,Chris Sawin,"With heavy influences from Studio Ghibli’s _Spirited Away_ and _Howl’s Moving Castle_, _Deep Sea_ is the best animated film of the year that most won’t see or even know about. Its extraordinary animation sets it apart from everything else out there because it feels like a brilliant, one-of-a-kind plunge into pure imaginative whimsy.

**Full review:** https://bit.ly/hyjinx",9.0
Dumb Money,CinemaSerf,"To be perfectly honest, I have never quite understood how you could make money buying stock in a company that you actually wanted to go bust! I watched this and I'm still not really any the wiser. It all centres around the internet influencer Keith Gill (Paul Dano) who quite fancied the undervalued stock in a video game store called ""GameStop"". He started to suggest to his followers that this was a decent buy - despite the fairly obvious fact that the venture capitalists were selling the company short with a view to it collapsing. Slowly but surely the word spreads and the stock starts to rise. What now ensues is a worm that turns story as the gazillionaires at their polo clubs find these gadfly small investors really are becoming a fly in their vichyssoise. Can the little guy prevail? This is quite an enjoyably paced drama with it's roots in reality but for me, the acting was really lacklustre and it drew a really simplistically linear distinction between the have and the have nots that didn't really intrigue my brain. It certainly demonstrates the power of the internet and that galvanising the population can easily buck some established business practices but somehow I didn't especially admire the little guys here either - they were to varying degrees just as aspirational, wanted what the rich guys had and didn't much care how they got it! Still, it's enjoyable enough to watch but I'd wait til it is on the television",6.0
Sometimes I Think About Dying,Manuel São Bento,"FULL SPOILER-FREE REVIEW @ https://www.msbreviews.com/movie-reviews/sometimes-i-think-about-dying-review-sundance-2023

""Sometimes I Think About Dying tackles social anxiety and loneliness in a purposefully dull yet intriguing fashion. Lingering cinematography, atmospheric score, and a phenomenal Daisy Ridley somehow make it all work, but its uneventful, repetitive narrative won't be for everyone.""

Rating: B-",6.0
Sometimes I Think About Dying,Louisa Moore - Screen Zealots,"**By: Louisa Moore / www.ScreenZealots.com**

I really love “Sometimes I Think About Dying,” director Rachel Lambert‘s low-key, melancholy character piece about a socially awkward woman who has an unmet desire for human connection. The unhurried pacing and measured storytelling may be challenging for some viewers, but this little film that seems to be about nothing is actually rooted in depth and has a keen understanding of what it feels like to suffer with crippling social awkwardness.

Living in a small coastal town on the dreary Oregon coast, Fran (Daisy Ridley) spends much of her time alone and often daydreams about dying. She works at a drab office and quietly observes her more outgoing coworkers as they chat with each other and go about their daily routines. She describes herself as “not very interesting,” is quiet and reserved, isn’t very sociable, has no friends, and mostly keeps to herself. This shyness is often mistaken for aloofness, and most everyone steers clear of any interactions with her. Things change when the friendly and slightly awkward Robert (Dave Merheje) starts a job at the company, and he takes an interest in Fran. She’s afraid to give friendship a chance, but there’s something different about him that may just make Robert the first person whom she allows to really get to know her.

There isn’t a whole lot of plot, but Lambert manages to keep her film compelling. Her storytelling style is highly detailed, which gives a warmth to the bleak tone. Nothing feels forced. Lambert paints a dreary portrait of humanity, but does so with wit, style, charm, and humor. There’s so much subtlety in what’s left unspoken, and the film shows us Fran’s professional and personal life, but never tells us what to feel.

The film is well cast from top to bottom, including Parvesh Cheena, Marcia DeBonis, and Megan Stalter, who add a lot of amusement as Fran’s office mates, and Merheje and Ridley feel charmingly authentic. Right down to her body language, from avoiding eye contact to a slouched posture when her character is feeling uncomfortable, Ridley wholly embodies what it must feel like to be Fran. It’s a skilled, effective performance, and one with few spoken words.

It may sound like a hard sell to sit through a movie that’s focused on a lead character who suffers from severe social anxiety, but “Sometimes I Think About Dying” is a good, simple story that’s told well. It’s a captivating film that gracefully expresses the need for human connection while being unable to rid yourself of debilitating melancholia.",8.0
Sometimes I Think About Dying,liena,"the best performance of daisy ridley, hands down. however, the movie's premise was obviously more suitable for a short movie and it lacked energy at some scenes. i still enjoyed it and i loved how well shot it was, the scenery was extremely beautiful.",8.0
Jeanne du Barry,Lachlan Thiele,"EXT. FRENCH JACK SPARROW – DAY

That’s all I have to say 

FADE OUT.",4.0
Cats in the Museum,CinemaSerf,"""Vinsent"" is a ginger cat who finds himself stranded on an island populated only by a rather savage, but dumb, dog and by a mouse. They inhabit a grand old mansion house where their daily routine is quite literally that - routine! Anyway, a storm comes along and this causes their home to crumble into the sea leaving the cat and his mouse friend ""Moris"" floating the seas inside a piano! Luckily, that's picked up by a tanker and next thing, they are in the world renowned Hermitage museum in St Petersburg and 'Vinsent"" is dragooned into a herd of other cats whose mission is to protect the priceless artwork. Needless to say, ""Moris"" finds his life now somewhat more perilous - especially as he has a penchant for dining on the fabric of fine art. The ""Mona Lisa"" is coming to visit and so everyone is on alert, security is heightened - bit still, it gets stolen. All fingers point to the mouse, but is there something more sinister going on that ""Vinsent"" can get to the bottom of? The animation here is all pretty basic, but it's still quite an enjoyably daft adventure with plenty going on, a few red herrings and just a little romance with the glamorous - if slightly curiously animated - ""Kleopatra"" before a denouement that I can think of plenty of ""art"" I'd want to volunteer for. I'm surprised this got an UK cinema release, and it's not really for children. Worth a watch, though.",6.0
The Taste of Things,CinemaSerf,"""Dodin"" (Benoît Magimel) and ""Eugénie"" (Juliette Binoche) have a synergy in the kitchen that creates mouthwatering and innovative culinary treats for their friends. She does the cooking, he more the design; she shuns the limelight, he is more gregarious - but it's a professional relationship that has worked well for the last two decades. It's probably fair to say that they are both a bit slow off the mark, but gradually now their relationship begins to become one of a more personal, intimate, nature but she is still uncertain. How to win her round? Well he starts to prepare delicacies to tempt both her palate and her heart. The path of truth love never runs smooth, though, and soon their dynamic is facing a testing time that will likely see unwelcome change for all concerned. What I actually liked about this film is that there's not a great deal of dialogue. It looks great and the two actors genuinely convince as they prepare their gourmet dishes using ingredients and techniques that are way more fascinating than the unfolding drama between their characters. You can almost smell the food! It also doesn't shy away from some of the culinary curiosities of rustic French cuisine, so be prepared for a few dishes that might not do for your appetite what they do for those on screen, but by two hours in I found myself genuinely invested in what I was watching - and very glad I'd eaten first. Cooking is an art form; so is good cinema - we get both here in abundance.",7.0
Monty Python and the Holy Grail,Filipe Manuel Neto,"**One of the pinnacles of British humor.**

This was my first contact with Monty Python, which I already knew famously, and I loved the movie. It is quite simply one of the high points of British humor. The film is easy enough to understand, parodying the Arthurian legends surrounding the quest for the Grail, but the story is just a pretext for successive jokes, each one better than the last.

I don't know the group of comedians very well, but I do know a number of great British comedy actors here, starting with John Clease, Terry Jones, Graham Chapman, Terry Gilliam, Michael Palin and Eric Idle. They are very good individually, but priceless together.

The film has several moments worth mentioning, starting perhaps with the witch trial, and then moving on to the fight with the black knight or the knights who say Ni. It's not a very long film, but it's really worth seeing every comic situation. The dialogues are full of hilarious moments. The ending, however, is a little less strong than expected, which does not take away from the film any of its merit.

Technically, it's not a remarkable film. There is no concern here with historical accuracy or rigorous recreation of the Middle Ages, nor does the film ask for it. We have stage costumes and props, obviously fake but functional, and interesting sets, in castles and in some reasonably well chosen places. There are some special effects and visuals, but they aren't notable. Be that as it may, it's a comedy that remains fresh despite the decades that have passed since its debut.",10.0
Monty Python and the Holy Grail,drystyx,"Seriously, you could die laughing from this film.
I remember the first time I watched this film, back in antenna days on the educational UHF station that was all fuzz, and even then I thought I would die laughing.
The story of King Arthur always did beg for such a satire.
The bits are almost all memorable. I durst not mention even one, because I would be tempted to mention a hundred more scenes and a thousand more lines.
This is very slapstick. I never thought I would laugh at cruelty, but when it is obviously so overdone that it can't be taken seriously, like a man having his arms and legs cut off and still thinking he's invincible, especially when the delivery is so perfect, I can't stop laughing. 
There are some people who don't like this film, but those people are wipers of other people's bottoms.",10.0
Monty Python and the Holy Grail,CinemaSerf,"Fortunately for me this was a rather short visit to the surreal land of Monty Python, and though it does have it's moments, I was really quite unimpressed by their Arthurian antics. We start with Graham Chapman's King Arthur gadding about England tying to recruit some suitably worthy individuals to sit at his round table. Task complete, he gets a sign from God that they must undertake the most holy of quests - and find the Cup of Christ. It now falls to the other three - Cleese, Idle and Gilliam - to dress up in suits of armour and seek the grail amongst the innuendo-ridden kingdom. Along the way they encounter the Black Knight, a castle full of sex-starved maidens, some monks - indeed just about everyone you might expect from mediaeval society before a really annoying denouement with the ""Knights of Ni"" - all they want is a little garden, or two... All but fifty years on, it's probably not really fair to look at this with 2024 eyes, but this was my first time of seeing it and I was really left thinking - why didn't the police get involved earlier? It's not that the jokes don't work, well not all of them, anyway - it's that they so labour the punchline. It's as if someone took a thirty minute sketch show and decided to pad it out for an extra hour. Less could certainly have been more. There are a few fun cameos - Carol Cleveland's ""Zoot"" and Connie Booth's witch stand out, but otherwise I felt a bit like I was the victim of some very dated hype. I didn't hate it, but really - what was all the fuss about?",6.0
Quicksand,Louisa Moore - Screen Zealots,"The premise of director Andres Beltran‘s “Quicksand” is the stuff of nightmares. This survivalist suspense thriller follows an estranged American couple (Carolina Gaitan, Allan Hawco) who, on the brink of divorce, travel to Bogotá, Colombia for a work conference. With a little downtime, they decide to take a hike in the rainforest despite the warnings of locals. A surprise storm causes them to become trapped in a pit of quicksand underneath the dense jungle canopy. Unable to move, their situation goes from bad to worse as they are paid a visit from a resident venomous snake.

It’s a simple story that’s terrifying to think about, and the film does a good job at setting up the narrative with a drama-heavy opening half hour. This isn’t an action packed film by any means, but more of a slow burn relationship drama with the added stressor of being stranded in quicksand with limited means of avoiding a deadly snake. The story is well thought out, and Hawco and Gaitan give solid enough performances that make you believe their situation is dire.

This isn’t a bad movie, but it does have its share of problems. The cinematography is dark and murky, which isn’t pleasurable to watch. It fits the bleak jungle setting, but there’s only so much viewers can enjoy about a drab palate of deep browns and drab grays. Some of the scenes are so dark that it’s difficult to see the action. The ending is excessively drawn out too, and there’s no real payoff. Although overall this is an disappointing film, it gets a lot of things right.

Low budget thrillers belong to a genre that often doesn’t require particularly strong direction, acting, or a massive amount of financial backing to make an effective movie, and that’s exactly what “Quicksand” is: a passable movie with a killer story that’s simply not good enough.",4.0
Passages,Brent Marchant,"Intimacy can be a beautiful thing. However, it can also become something messy, hurtful and emotionally devastating when tainted by self-serving agendas, irresponsible intentions, or reckless, short-sighted experimentation, influences that can purposely or unwittingly end up wreaking widespread havoc. Such is the case in writer-director Ira Sachs’s new domestic drama about a flamboyant, free-spirited gay male filmmaker, Tomas (Franz Rogowski), who impulsively jumps into an impromptu fling with a woman, Agathe (Adèle Exarchopoulos), a relationship that leaves his longtime husband, Martin (Ben Whishaw), unsure of what the couple’s future might hold. As time passes, circumstances grow increasingly complicated as each member of this unlikely trio tries to sort out what lies ahead, particularly with the emergence of Tomas’s ever-growing thoughtless capriciousness. Some viewers may look upon the story’s shockingly reprehensible developments as improbable and appalling, but, sadly, as anyone who has ever watched tabloid TV can probably attest, the events depicted here might not appear as far-fetched as one might think. In that respect, this offering presents a bold, courageous, honest look at what can go awry in situations like this, an account loaded with incensed outrage, unbridled ire, biting humor and more than a little cynicism. It’s a narrative that some audience members may find offensive, even deplorable, but, like a horrific car accident, it’s also something that many viewers might find difficult to look away from, thanks in large part to the wholly convincing performances of the three protagonists. Sensitive viewers should be aware that the film includes a fair amount of explicit and provocative sexual content, so those easily offended by such material may not want to put this one on their watch lists. However, for those who appreciate domestic dramas that hold nothing back and that aren’t afraid to get down and dirty in their portrayals of what can happen, this release is about as good as any out there. Just be prepared to be left with your jaw agape – and your head spinning.",7.0
Passages,CinemaSerf,"""Tomas"" (Franz Rogowski) and husband ""Martin"" (Ben Whishaw) find their marriage severley tested when the former man starts to fall for ""Agathe"" (Adèle Exarchopoulos) and that passion drives ""Martin"" into the arms of ""Amad"" (Erwan Kepoa Falé). What now ensues is, frankly, a rather dull introspective of characters that didn't really leap off the screen at me. Rogowski can be a charismatic actor, but here he offers us a rather unremarkable characterisation of a horny man who wants to have his cake and eat it. Whishaw is, routinely these days on screen, just a bit weedy and presents another weakly constructed individual who seems content not to fight for the man he's supposed to love. It's all just rolls along without really catching fire, it's over-scripted and though it may well have a visual authenticity to it, it's all just a bit so what? The production and pacing all contribute to the general ennui of the whole thing and to be honest, I was just a bit disappointed with this rather lacklustre enterprise. I saw it at the cinema this week, but I suspect even the most ardent fans of these three can wait for a television screening.",6.0
What's Love Got to Do with It?,CinemaSerf,"If you remember ""Last Christmas"" (2019) then you will have a rough idea of what to expect here with this rather formulaic, if colourful, drama. It all centres around a film being made by ""Zoe"" (Lily James) about the forthcoming ""assisted"" marriage of her lifelong friend ""Kaz"" (Shazad Latif). Her mother ""Cath"" (Dame Emma Thompson) lives next door to his family and so is relishing the family trip to Pakistan for the traditional wedding. ""Zoe"" is (as, I suspect, are we) pretty sceptical of the whole arrangement - getting married to someone you've only met on Skype, but proceed we do through a lively ceremony that allows Dame Emma to don her sari and dance for all she is worth (gin-fuelled!) whilst the predictable love triangle melodrama slowly, but predictably, plays out. It all comes to an head when they have returned home and she shows her film to all concerned and, just like this, it receives mixed and divisive reviews. I found this all very twee, middle class and vaguely judgmental which after a while I felt rather defeated the purpose in the first place. It is pretty clear from the start what is going to happen, and although the route to that conclusion isn't exactly a straight line, this leaves very little room for jeopardy to a plot you can see from Mars. Latif has a degree of charm to him, and some of the scenes with Lily James are quite engaging in a cheesy sort of way, but for the most part this is eminently forgettable fayre that will do fine on telly at Christmas.",6.0
What's Love Got to Do with It?,r96sk,"Largely underwhelming, even if <em>'What’s Love Got to Do with It?'</em> holds a few redeeming qualities.

It's all competently shot and all that, the music for example is excellent - nice work, Nitin Sawhney & Co. The level of acting is also all good, though I wouldn't say there is necessarily anyone that stands out individually. On that note, Emma Thompson: As usual I like her, but her character isn't the best - I feel like I've seen her play the same (similar, at best) character one or two times before recently-ish, <em>'Last Christmas'</em> for example. She's merits more to work with.

The story is one that is almost as old as time, like with the aforementioned I feel like I've seen this plot play out many a time. It has a couple of unique elements I guess, but overall it's pretty derivative. I'm also not sold on Lily James' Zoe being 'Player 1', so to speak... like, her character is fairly meh.

In fact, I'd go as far to say that Mariam Haque's Jamila should've been the film's key - that part of the story interested me the most of anything else portrayed onscreen. Haque and Michael Marcus's portion only features relatively smally, so I kinda wish they used them two instead as their bits are the most touching.

All in all, it's fine - but is too mundane and predictable to be definitively enjoyable, in my opinion of course.",6.0
